{
  "counts": {
    "baseline_artifact_types": 30,
    "office_deliverables": 10,
    "policy_overlays": 23,
    "records": 53
  },
  "library": {
    "authority_model": "generated-view-working-record-executed-evidence",
    "created_on": "2026-08-28",
    "library_name": "Qi Movie Production Template Library",
    "library_version": "0.2.2",
    "limitations": [
      "Jurisdiction-specific legal, labor, guild, insurance, permit, tax, privacy, safety, and distribution requirements require current qualified review.",
      "CMF, Telefilm, CAVCO, CRA, treaty-coproduction, and provincial or territorial decisions remain separate external authority events.",
      "Program names, availability, deadlines, rates, treaty terms, forms, and reporting rules must be refreshed from current official sources before use.",
      "Blank, generated, or completed-looking templates do not constitute signed, issued, verified, or approved evidence.",
      "The shot taxonomy is a composable planning vocabulary, not an exhaustive rulebook or a substitute for story, department, safety, and approval decisions.",
      "Structural library verification does not authorize production, delivery, or publication."
    ],
    "source_prd": "../docs/PRD_AUTOMATED_MOVIE_PRODUCTION_PIPELINE.md",
    "status": "reusable working library with normalized shot taxonomy plus modular Canada and international funding overlay",
    "updated_on": "2026-08-30"
  },
  "records": [
    {
      "artifact_key": "CALL_SHEET",
      "artifact_name": "Call sheet",
      "authority_class": "Generated view",
      "baseline_number": 1,
      "bundle": "Operations",
      "default_applicability": "REQUIRED",
      "default_scope": "Production day",
      "evidence_boundary": "Operational compilation; never authorization by itself",
      "gate_relevance": "Daily readiness",
      "kind": "BASELINE",
      "materialization_mode": "GENERATED_VIEW",
      "record_id": "B-001",
      "source_format": "XLSX",
      "template_file": "02_Production_Planning/Production_Planning_Workbook.xlsx",
      "template_locator": "Call Sheet"
    },
    {
      "artifact_key": "PRODUCTION_SCHEDULE",
      "artifact_name": "Production schedule",
      "authority_class": "Working record",
      "baseline_number": 2,
      "bundle": "Operations",
      "default_applicability": "REQUIRED",
      "default_scope": "Production version",
      "evidence_boundary": "Requires authorized approval to become current",
      "gate_relevance": "Package and daily readiness",
      "kind": "BASELINE",
      "materialization_mode": "WORKING_RECORD",
      "record_id": "B-002",
      "source_format": "XLSX",
      "template_file": "02_Production_Planning/Production_Planning_Workbook.xlsx",
      "template_locator": "Production Schedule"
    },
    {
      "artifact_key": "STRIPBOARD",
      "artifact_name": "Stripboard",
      "authority_class": "Generated view",
      "baseline_number": 3,
      "bundle": "Breakdown",
      "default_applicability": "REQUIRED",
      "default_scope": "Production version",
      "evidence_boundary": "Rebuild from current scene and schedule facts",
      "gate_relevance": "Planning",
      "kind": "BASELINE",
      "materialization_mode": "GENERATED_VIEW",
      "record_id": "B-003",
      "source_format": "XLSX",
      "template_file": "02_Production_Planning/Production_Planning_Workbook.xlsx",
      "template_locator": "Stripboard"
    },
    {
      "artifact_key": "DAY_OUT_OF_DAYS",
      "artifact_name": "Day out of days",
      "authority_class": "Generated view",
      "baseline_number": 4,
      "bundle": "Breakdown",
      "default_applicability": "REQUIRED",
      "default_scope": "Production version",
      "evidence_boundary": "Rebuild from schedule and cast assignment",
      "gate_relevance": "Labor and logistics",
      "kind": "BASELINE",
      "materialization_mode": "GENERATED_VIEW",
      "record_id": "B-004",
      "source_format": "XLSX",
      "template_file": "02_Production_Planning/Production_Planning_Workbook.xlsx",
      "template_locator": "Day Out of Days"
    },
    {
      "artifact_key": "ONE_LINER",
      "artifact_name": "One liner",
      "authority_class": "Generated view",
      "baseline_number": 5,
      "bundle": "Breakdown",
      "default_applicability": "REQUIRED",
      "default_scope": "Creative revision",
      "evidence_boundary": "Binds to exact source revision",
      "gate_relevance": "Package readiness",
      "kind": "BASELINE",
      "materialization_mode": "GENERATED_VIEW",
      "record_id": "B-005",
      "source_format": "XLSX",
      "template_file": "02_Production_Planning/Production_Planning_Workbook.xlsx",
      "template_locator": "One Liner"
    },
    {
      "artifact_key": "SCRIPT_BREAKDOWN",
      "artifact_name": "Script breakdown",
      "authority_class": "Working record",
      "baseline_number": 6,
      "bundle": "Breakdown",
      "default_applicability": "REQUIRED",
      "default_scope": "Scene",
      "evidence_boundary": "Human review required for production elements and risks",
      "gate_relevance": "Package and risk",
      "kind": "BASELINE",
      "materialization_mode": "WORKING_RECORD",
      "record_id": "B-006",
      "source_format": "XLSX",
      "template_file": "02_Production_Planning/Production_Planning_Workbook.xlsx",
      "template_locator": "Script Breakdown"
    },
    {
      "artifact_key": "SHOT_LIST",
      "artifact_name": "Shot list",
      "authority_class": "Working record",
      "baseline_number": 7,
      "bundle": "Visual Plan",
      "default_applicability": "REQUIRED",
      "default_scope": "Scene or shot",
      "evidence_boundary": "Human-curated capture intent",
      "gate_relevance": "Creative and department approval",
      "kind": "BASELINE",
      "materialization_mode": "WORKING_RECORD",
      "record_id": "B-007",
      "source_format": "XLSX",
      "template_file": "02_Production_Planning/Production_Planning_Workbook.xlsx",
      "template_locator": "Shot List"
    },
    {
      "artifact_key": "STORYBOARDS",
      "artifact_name": "Storyboards",
      "authority_class": "Working record",
      "baseline_number": 8,
      "bundle": "Visual Plan",
      "default_applicability": "REQUIRED",
      "default_scope": "Scene or shot",
      "evidence_boundary": "Reference assets require rights and provenance",
      "gate_relevance": "Creative and department approval",
      "kind": "BASELINE",
      "materialization_mode": "CURATED_PACKAGE",
      "record_id": "B-008",
      "source_format": "PPTX",
      "template_file": "01_Creative_Development/Visual_Development_Templates.pptx",
      "template_locator": "Storyboard slides"
    },
    {
      "artifact_key": "TREATMENT",
      "artifact_name": "Treatment",
      "authority_class": "Working record",
      "baseline_number": 9,
      "bundle": "Visual Plan",
      "default_applicability": "REQUIRED",
      "default_scope": "Title or creative revision",
      "evidence_boundary": "Human approval required",
      "gate_relevance": "Creative lock",
      "kind": "BASELINE",
      "materialization_mode": "WORKING_RECORD",
      "record_id": "B-009",
      "source_format": "DOCX",
      "template_file": "00_Governance/Creative_and_Governance_Template_Pack.docx",
      "template_locator": "Treatment"
    },
    {
      "artifact_key": "MOOD_BOARD",
      "artifact_name": "Mood board",
      "authority_class": "Working record",
      "baseline_number": 10,
      "bundle": "Visual Plan",
      "default_applicability": "REQUIRED",
      "default_scope": "Title or creative revision",
      "evidence_boundary": "Reference assets require rights and provenance",
      "gate_relevance": "Visual alignment",
      "kind": "BASELINE",
      "materialization_mode": "CURATED_PACKAGE",
      "record_id": "B-010",
      "source_format": "PPTX",
      "template_file": "01_Creative_Development/Visual_Development_Templates.pptx",
      "template_locator": "Mood board slides"
    },
    {
      "artifact_key": "LOOK_BOOK",
      "artifact_name": "Look book",
      "authority_class": "Working record",
      "baseline_number": 11,
      "bundle": "Visual Plan",
      "default_applicability": "REQUIRED",
      "default_scope": "Title or creative revision",
      "evidence_boundary": "Reference assets require rights and provenance",
      "gate_relevance": "Department alignment",
      "kind": "BASELINE",
      "materialization_mode": "CURATED_PACKAGE",
      "record_id": "B-011",
      "source_format": "PPTX",
      "template_file": "01_Creative_Development/Visual_Development_Templates.pptx",
      "template_locator": "Look book slides"
    },
    {
      "artifact_key": "COLOUR_PALETTE",
      "artifact_name": "Colour palette",
      "authority_class": "Working record",
      "baseline_number": 12,
      "bundle": "Visual Plan",
      "default_applicability": "REQUIRED",
      "default_scope": "Title or creative revision",
      "evidence_boundary": "Approval does not clear reference rights",
      "gate_relevance": "Continuity and color pipeline",
      "kind": "BASELINE",
      "materialization_mode": "CURATED_PACKAGE",
      "record_id": "B-012",
      "source_format": "PPTX",
      "template_file": "01_Creative_Development/Visual_Development_Templates.pptx",
      "template_locator": "Colour palette slides"
    },
    {
      "artifact_key": "TALENT_RELEASE",
      "artifact_name": "Talent release forms",
      "authority_class": "Executed evidence or hybrid",
      "baseline_number": 13,
      "bundle": "People and Place",
      "default_applicability": "REQUIRED",
      "default_scope": "Performer and usage scope",
      "evidence_boundary": "Only properly executed and verified release counts as evidence",
      "gate_relevance": "Hard production and release gates",
      "kind": "BASELINE",
      "materialization_mode": "HYBRID",
      "record_id": "B-013",
      "source_format": "DOCX",